{
  "schema_version": 1,
  "lane": "structural",
  "run": {
    "route": "/pricing",
    "url": "http://localhost:3000/pricing",
    "run_status": "completed"
  },
  "metadata": {
    "axe_version": "4.12.1",
    "ruleset_tags": ["wcag2a", "wcag2aa", "wcag21aa", "wcag22aa", "best-practice"],
    "wcag_target": "AA",
    "browser_version": "chromium/1179",
    "render_environment_id": "ubuntu-22.04-fontconfig-2.13.1@sha256:3f1a9c",
    "timestamp": "2026-07-09T12:00:00Z",
    "expected_main_content": { "/pricing": "#pricing-detail" }
  },
  "validity_envelope": {
    "criteria_count_pct": 32,
    "criteria_count": "16 of 50",
    "issue_volume_pct": 57,
    "vendor_reported": true,
    "independently_audited": false,
    "disclaimer": "Both the ~32 percent criteria-count figure and the ~57 percent issue-volume figure are vendor-reported by Deque, not independently audited. A structural pass is not usable, is not good UI. This is not a WCAG conformance certification.",
    "non_automatable_classes": ["focus order", "focus visible", "keyboard operability"],
    "best_practice_labeled": ["heading-order"]
  },
  "violation_ids": [],
  "incomplete_ids": [],
  "findings": [
    {
      "lane": "structural",
      "source": "axe",
      "finding_id": "f-pricing-axe-button-name",
      "code": "axe:button-name",
      "rule_id": "button-name",
      "impact": "critical",
      "severity": 4,
      "target_element_identifier": "button#buy",
      "target_selector": "button#buy",
      "route": "/pricing",
      "help": "CR5-M11: target_element_identifier button#buy matches the persona side, but route differs (/pricing vs /checkout) — the verbatim route key must NOT join across a route mismatch"
    }
  ]
}
