{
  "schema_version": 1,
  "lane": "structural",
  "run": {
    "route": "/signup",
    "url": "http://localhost:3000/signup",
    "run_status": "completed"
  },
  "metadata": {
    "axe_version": "4.12.1",
    "ruleset_tags": [
      "wcag2a",
      "wcag2aa",
      "wcag21aa",
      "wcag22aa",
      "best-practice"
    ],
    "wcag_target": "AA",
    "browser_version": "chromium/1179",
    "render_environment_id": "ubuntu-22.04-fontconfig-2.13.1@sha256:3f1a9c",
    "timestamp": "2026-07-09T12:00:00Z",
    "expected_main_content": {
      "/signup": "#audiobook-text"
    }
  },
  "validity_envelope": {
    "criteria_count_pct": 32,
    "criteria_count": "16 of 50",
    "issue_volume_pct": 57,
    "vendor_reported": true,
    "independently_audited": false,
    "disclaimer": "Both the ~32 percent criteria-count figure and the ~57 percent issue-volume figure are vendor-reported by Deque, not independently audited. A structural pass is not usable, is not good UI. This is not a WCAG conformance certification.",
    "non_automatable_classes": [
      "focus order",
      "focus visible",
      "keyboard operability"
    ],
    "best_practice_labeled": [
      "heading-order"
    ]
  },
  "violation_ids": [
    "button-name",
    "link-name",
    "region",
    "color-contrast"
  ],
  "incomplete_ids": [],
  "findings": [
    {
      "lane": "structural",
      "source": "axe",
      "finding_id": "f-signup-axe-button-name",
      "code": "axe:button-name",
      "rule_id": "button-name",
      "impact": "critical",
      "severity": 4,
      "target_element_identifier": "button.a",
      "target_selector": "button.a",
      "route": "/signup",
      "help": "axe button-name (critical impact)"
    },
    {
      "lane": "structural",
      "source": "axe",
      "finding_id": "f-signup-axe-link-name",
      "code": "axe:link-name",
      "rule_id": "link-name",
      "impact": "serious",
      "severity": 3,
      "target_element_identifier": "a.b",
      "target_selector": "a.b",
      "route": "/signup",
      "help": "axe link-name (serious impact)"
    },
    {
      "lane": "structural",
      "source": "axe",
      "finding_id": "f-signup-axe-region",
      "code": "axe:region",
      "rule_id": "region",
      "impact": "moderate",
      "severity": 2,
      "target_element_identifier": "div.c",
      "target_selector": "div.c",
      "route": "/signup",
      "help": "axe region (moderate impact)"
    },
    {
      "lane": "structural",
      "source": "axe",
      "finding_id": "f-signup-axe-color-contrast",
      "code": "axe:color-contrast",
      "rule_id": "color-contrast",
      "impact": "minor",
      "severity": 1,
      "target_element_identifier": "span.d",
      "target_selector": "span.d",
      "route": "/signup",
      "help": "axe color-contrast (minor impact)"
    }
  ]
}
